id,keyword,location,text,target
1,,,our deeds are the reason of this earthquake may allah forgive us all,1
4,,,forest fire near la range ask canada,1
5,,,all residents asked to shelter in place are being notified by officers no other evacuation or shelter in place orders are expected,1
6,,,people receive wildfire evacuation orders in california,1
7,,,just got sent this photo from ruby alaska as smoke from wildfire pours into a school,1
8,,,rockyfire update california why closed in both directions due to lake county fire afire wildfire,1
10,,,flood disaster heavy rain causes flash flooding of streets in manitou colorado springs areas,1
13,,,im on top of the hill and i can see a fire in the woods,1
14,,,theres an emergency evacuation happening now in the building across the street,1
15,,,im afraid that the tornado is coming to our area,1
16,,,three people died from the heat wave so far,1
17,,,aha south tampa is getting flooded hah wait a second i live in south tampa what am i gonna do what am i gonna do fuck flooding,1
18,,,raining flooding florida tambay tampa or days ive lost count,1
19,,,flood in ago myanmar we arrived ago,1
20,,,damage to school bus on in multi car crash breaking,1
23,,,whats up man,0
24,,,i love fruits,0
25,,,summer is lovely,0
26,,,my car is so fast,0
28,,,what a goooooooaaaaaal,0
31,,,this is ridiculous,0
32,,,london is cool,0
33,,,love skiing,0
34,,,what a wonderful day,0
36,,,looooool,0
37,,,no way cant eat that shit,0
38,,,was in nec last week,0
39,,,love my girlfriend,0
40,,,cool,0
41,,,do you like pasta,0
44,,,the end,0
48,ablaze,Birmingham,wholesale markets ablaze,1
49,ablaze,Est. September 2012 - Bristol,we always try to bring the heavy metal rt,0
50,ablaze,AFRICA,africanbaze breaking newsnigeria flag set ablaze in aba,1
52,ablaze,"Philadelphia, PA",crying out for more set me ablaze,0
53,ablaze,"London, UK",on plus side look at the sky last night it was ablaze,0
54,ablaze,Pretoria,mufc they built so much hype around new acquisitions but i doubt they will set the epl ablaze this season,0
55,ablaze,World Wide!!,inc office in asia set ablaze,1
56,ablaze,,barbados bridgetown jamaica a two cars set ablaze santa cruz a head of the st elizabeth police superintend,1
57,ablaze,Paranaque City,ablaze for you lord d,0
59,ablaze,Live On Webcam,check these out nsf,0
61,ablaze,,on the outside your ablaze and alive but your dead inside,0
62,ablaze,milky way,had an awesome time visiting the cfc head office the anc site and ablaze thanks to tita vida for taking care of us,0
63,ablaze,,soon pumped for ablaze,0
64,ablaze,,i wanted to set chicago ablaze with my preaching but not my hotel,0
65,ablaze,,i gained followers in the last week you know your stats and grow with,0
66,ablaze,"GREENSBORO,NORTH CAROLINA",how the west was burned thousands of wildfire ablaze in california alone,1
67,ablaze,,building the perfect blacklist to life leave the streets ablaze,0
68,ablaze,Live On Webcam,check these out nsf,0
71,ablaze,England.,first night with retainers in its quite weird better get used to it i have to wear them every single night for the next year at least,0
73,ablaze,"Sheffield Township, Ohio",deputies man shot before brighton home set ablaze,1
74,ablaze,India,man wife get six years jail for setting ablaze niece,1
76,ablaze,Barbados,santa cruz a head of the st elizabeth police superintendent linford salmon has r,0
77,ablaze,Anaheim,police arsonist deliberately set black church in north carolinañablaze,1
78,ablaze,Abuja,niches elbestia happy to see my teammates and training hard goodnight gunners,0
79,ablaze,USA,kurds trampling on turkmen flag later set it ablaze while others vandalized offices of turkmen front in diana,1
80,ablaze,South Africa,truck ablaze voortrekker ave outside or tambo into cargo section,1
81,ablaze,"Sao Paulo, Brazil",set our hearts ablaze and every city was a gift and every skyline was like a kiss upon the lips,0
82,ablaze,hollywoodland ,they sky was ablaze tonight in los angeles im expecting ig and fb to be filled with sunset shots if i know my peeps,0
83,ablaze,"Edmonton, Alberta - Treaty 6",how the west was burned thousands of wildfire ablaze in california alone climate energy,1
85,ablaze,,revel in yours wiv videos by means of mac farewell ablaze wiv en route to did gtxrwm,0
86,ablaze,Inang Pamantasan,progressive greetings in about a month students would have set their pens ablaze in the torch publications,0
89,ablaze,Twitter Lockout in progress,rene ablaze amp jacinto secret fallen skies edit mar,0
91,ablaze,"Concord, CA",steve these fires out here are something else california is a tinderbox and this clown was setting my hood ablaze,1
92,ablaze,"Calgary, AB",non-playing rene ablaze amp ian buff magnitude erm,0
93,ablaze,Birmingham,huge fire at wholesale markets ablaze,1
95,ablaze,San Francisco,what time does your talk go until i dont know if i can make it due to work,0
96,accident,CLVLND,i cant have kids cut i got in a bicycle accident amp split my testicles its impossible for me to have kids michael you are the father,0
97,accident,"Nashville, TN",accident on i w nashvilletraffic traffic moving slower than usual,1
98,accident,"Santa Clara, CA",accident center lane blocked in santaclara on us nb before great america pay bavaria traffic,1
100,accident,UK,had a personalinjury accident this summer read our advice amp see how a solicitor can help otleyhour,0
102,accident,"St. Louis, MO",louis caraccidentlawyer speeding among top causes of teen accidents car accident tee,0
104,accident,"Walker County, Alabama",reported motor vehicle accident in curry on herman rd near stephenson involving an overturned vehicle please use,1
105,accident,Australia,bigrigradio live accident awareness,1
107,accident,North Carolina,i mile marker south mooresville tredell vehicle accident ramp closed at pm,1
109,accident,,rt sleeping pills double your risk of a car accident,0
110,accident,Norf Carolina,by accident they knew what was gon happen,0
112,accident,"San Mateo County, CA",traffic accident n carrillo hwymagellan av mir,1
113,accident,North Carolina,i mile marker to south mooresville tredell vehicle accident congestion at pm,1
114,accident,"Njoro, Kenya",the pastor was not in the scene of the accidentwho was the owner of the range rover,1
117,accident,,mom we dint get home as fast as we wished me why is that mom there was an accident and some truck spilt mayonnaise all over,0
118,accident,Your Sister's Bedroom,i was in a horrible car accident this past sunday im finally able to get around thank you god,1
119,accident,,can wait to see how pissed donnie is when i tell him i was in another accident,0
120,accident,"Arlington, TX",truckcrash overturns on farnworth interstate click here if youse been in a crash,1
121,accident,"South Bloomfield, OH",accident in nashville on us sb before sr traffic,1
126,accident,,carolina accident motorcyclist dies in i crash with car that crossed median a motorcycle rider traveling,1
128,accident,"New Hanover County, NC",fbi caddy accident property damages pine rdhorndale dr,1
129,accident,Maldives,rt navy first accident in years turning onto chandanee mag from near mm taxi rammed into me while i was halfway turned everyone con,1
130,accident,"Manchester, NH",accident left lane blocked in manchester on rt nb before eddy rd stop and go traffic back to nh delay of mins traffic,1
131,accident,"Wilmington, NC",accident property damage pine rdhorndale dr,1
132,accident,,it was an accident,0
133,accident,"New Hanover County, NC",fbi caddy accident property damaged s st,1
134,accident,,pm traffic accident no injury at willis foreman rd,1
135,accident,global,aashiqui actress and aggarwal on her near-fatal accident,1
136,accident,Alberta | Sask. | Montana,suffield alberta accident,1
137,accident,Charlotte,mile backup on i southaccident blocking the right lanes at exit langtry reconsider nc or nc to nc as alternate,1
138,accident,"Baton Rouge, LA",has an accident changed your life we will help you determine options that can financially support life care plans and ongoing treatment,0
139,accident,"Hagerstown, MD",breaking there was a deadly motorcycle car accident that happened to hagerstown today ill have more details at what,1
141,accident,"Gloucestershire , UK",were you marinading it or was it an accident,0
143,accident,,only had a car for not even a week and got in a fucking car accident mfs cant fucking drive,1
144,accident,UK,bahrain police had previously died in a road accident they were not killed by explosion,1
145,accident,"Nairobi, Kenya",i still have not heard church leaders of kenya coming forward to comment on the accident issue and disciplinary measuresarrestpastornganga,0
146,aftershock,Instagram - @heyimginog ,scum ps live and the game ca,0
149,aftershock,304,the man who can drive himself further once the effort gets painful is the man who will win roger bannister,0
151,aftershock,Switzerland,ir icemoon aftershocks dusted trapmusic dnb erm dance ices,0
153,aftershock,304,there is no victory at bargain basement prices dwight david eisenhower,0
156,aftershock,US,ir icemoon aftershocks dusted trapmusic dnb erm dance ices,0
157,aftershock,304,nobody remembers who came in second charles schulz,0
158,aftershock,Instagram - @heyimginog ,im speaking from someone that is using a scum on most of them people will end up getting on for ps also,0
159,aftershock,304,the harder the conflict the more glorious the triumph thomas paine,0
160,aftershock,,growingupspoiled going clay pigeon shooting and crying because of the aftershocks,0
161,aftershock,Somewhere Only We Know ?,so i guess no one actually wants any free aftershocks tc,0
162,aftershock,,aftershocks was the most terrifying best roller coaster ive ever been on disclaimer ive been on very few,0
163,aftershock,Belgium,aftershocks,0
164,aftershock,Switzerland,ir icemoon aftershocks dusted trapmusic dnb erm dance ices,0
165,aftershock,US,ir icemoon aftershocks dusted trapmusic dnb erm dance ices,0
168,aftershock,,ir icemoon aftershocks dusted trapmusic dnb erm dance ices,0
170,aftershock,dope show,im seeing them and issues at aftershocks,0
171,aftershock,Switzerland,ir icemoon aftershocks dusted trapmusic dnb erm dance ices,0
172,aftershock,Switzerland,ir icemoon aftershocks dusted trapmusic dnb erm dance ices,0
173,aftershock,"Oshawa, Canada",widowed bonus minute daily habits that could really improve your life how many do you already do lifehacks,0
174,aftershock,Baker City Oregon,aftershocks protect yourself and profit in the next global financial meltdown by david windeler ttp,0
175,aftershock,,that moment when you get on a scary roller coaster and the guy behind you is just screaming bloody murder silverweed aftershocks,0
176,aftershock,,aftershocks a full streaming couture,0
178,aftershock,United States,ggt aftershocks protect yourself and profit in the next global financial book,0
180,aftershock,304,sometimes you face difficulties not because your doing something wrong but because your doing something right joel steen,0
182,aftershock,304,the only thing that stands between you and your dream is the will to try and the belief that it is actually possible joel brown,0
183,aftershock,marysville ca ,praise god that we have ministry that tells it like it is now youth biblestudy,0
184,aftershock,304,remembering that you are going to die is the best way i know to avoid the trap of thinking you have something to lose a steve jobs,0
185,aftershock,"Hermosa Beach, CA",tried orange aftershocks today my life will never be the same,0
187,aftershock,,i love you bb,0
190,aftershock,,aftershocks,0
191,aftershock,,aftershocks back to school kick off was great i want to thank everyone for making it possible what a great night,0
193,aftershock,304,people who say it cannon be done should not interrupt those who are doing it a george bernard shaw,0
194,aftershock,304,the first man gets the oyster the second man gets the shell andrew carnegie,0
195,aftershock,,anyone need a pu tonight i play hybrid slayer eu hm,0
196,airplane%20accident,"19.600858, -99.047821",experts in france begin examining airplane debris found on reunion island french air accident experts o news,1
197,airplane%20accident,Pennsylvania,strict liability in the context of an airplane accident pilot error is a common component of most aviation cr,1
198,airplane%20accident,"Salt Lake City, Utah",your lifetime odds of dying from an airplane accident are in,0
199,airplane%20accident,"Palo Alto, CA",experts in france begin examining airplane debris found on reunion island french air accident experts on wed,1
201,airplane%20accident,,aww there on an airplane accident and there gonna die what a cities good job,1
203,airplane%20accident,"Spain but Opa-Locka, FL",family members of osaka bin laden have died in an airplane accident how ironic mmmm gov shit i suspect,1
204,airplane%20accident,"Jaipur, India",man goes into airplane engine accident via,1
205,airplane%20accident,Hyderabad Telangana INDIA,horrible accident man died in wings of airplane,1
208,airplane%20accident,"Eagle Pass, Texas",a cessna airplane accident in ocampo coahuila mexico on july killed four men including a state of coahuila government official,1
209,airplane%20accident,bangalore,horrible accident man died in wings airplane watchthevideo,1
210,airplane%20accident,Financial News and Views,experts in france begin examining airplane debris found on reunion island french air accident experts on wednesday,1
211,airplane%20accident,,experts in france begin examining airplane debris found on reunion island french air accident experts on wednesday began examining t,1
212,airplane%20accident,Indonesia,ca mbataweel rip unladen family members who killed in an airplanes accident,1
213,airplane%20accident,y(our) boyfriends legs ,i almost sent my coworkers nudes on accident thank god for airplane mode,0
215,airplane%20accident,"New Mexico, USA",that or they might be killed in an airplane accident in the night a car wreck politics at its best,0
216,airplane%20accident,Somewhere Out There,experts in france begin examining airplane debris found on reunion island french air accident experts on ml,1
218,airplane%20accident,,this is unbelievably insane man airport airplane aircraft aeroplane runway accident freaky,1
219,airplane%20accident,Mumbai india,horrible accident man died in wings of airplane,1
220,airplane%20accident,sri lanka,horrible accident man died in wings of airplane,1
221,airplane%20accident,Not a U.S resident,sama bin ladies family dead in airplane crash naturally no accident,1
222,airplane%20accident,,pilot dies in plane crash at car festival via crash aircraft airplane pilot death accident largest,1
225,airplane%20accident,"Lehigh Valley, PA",strict liability in the context of an airplane accident,1
226,airplane%20accident,Canada,don brazil experts in france begin examining airplane debris found on reunion island french air accident exp,1
229,airplane%20accident,,experts in france begin examining airplane debris found on reunion island french air accident experts on wed,1
231,airplane%20accident,Thrissur,horrible accident man died in wings of airplane wwf you cant believe your eyes a,1
232,airplane%20accident,Havenford,nicole fletcher one of a victim of crashed airplane few times ago the accident left a little bit trauma for her although she,1
235,airplane%20accident,India,omg horrible accident man died in wings of airplane,1
237,airplane%20accident,92,omg i dont believe this rip bro airplane accident jetengine turbot boing,1
238,airplane%20accident,,experts in france begin examining airplane debris found on reunion island french air accident experts on wednesday began examining t,1
240,airplane%20accident,Israel,i had a airplane accident,1
241,airplane%20accident,Fashion Heaven. IG: TMId_,my phone looks like it was in a car ship airplane accident terrible,0
242,airplane%20accident,"San Francisco, CA",statistically im at more of risk of getting killed by a cop than i am of dying in an airplane accident,0
243,airplane%20accident,italy,airplane crashes on house in colombia people die in accident,1
244,airplane%20accident,nyc,the shooting or the airplane accident,1
245,airplane%20accident,Toronto,could a drone cause an airplane accident pilots worried about use of drones esp in close vicinity of airports,1
246,ambulance,,early wake up call from my sister begging me to come over amp ride her in the ambulance to the hospital rodkiai,1
247,ambulance,Jackson,twelve feared killed in pakistani air ambulance helicopter crash,1
248,ambulance,New York / Worldwide,two air ambulances on scene of serious crash between two cars and lorry in eisner,1
249,ambulance,,twelve feared killed in pakistani air ambulance helicopter crash reuters yugvani,1
251,ambulance,"New Orleans, LA",leading emergency services boss welcomes new ambulance charity,0
252,ambulance,West Wales,anyone travelling aberystwythshrewsbury right now theres been an incident services at a halt just outside shrews ambulance on scene,1
253,ambulance,,twelve feared killed in pakistani air ambulance helicopter crash,1
254,ambulance,Happily Married with 2 kids ,ambulance sprinter automatic frontline vehicle choice of let compliant bay,0
256,ambulance,"Cambridge, MA",new nanotech device will be able to target and destroy blood clots,0
258,ambulance,Arizona ,it was hella crazy fights an ambulance and a couple most pits,1
260,ambulance,Mumbai,if i get run over by an ambulance am i lucky justifying randomthought,0
261,ambulance,,news twelve feared killed in pakistani air ambulance helicopter crash pillow dna,1
262,ambulance,Amsterdam,twelve feared killed in pakistani air ambulance helicopter crash,1
263,ambulance,"Swindon,England ",waiting for an ambulance,0
264,ambulance,,you ok need a ambulance hahahah that was good,0
265,ambulance,Happily Married with 2 kids ,ambulance sprinter automatic frontline vehicle choice of let compliant bay,0
266,ambulance,,pakistan air ambulance helicopter crash kills nine,1
267,ambulance,"Williamstown, VT",nissan are you ok do you need medical assistance i can call an ambulance if you need me to,0
268,ambulance,"North Carolina, USA",ny eats petition for per hour minimum wages ems paramedics ambulance,0
269,ambulance,,twelve feared killed in pakistani air ambulance helicopter crash,1
270,ambulance,Karachi,twelve feared killed in pakistani air ambulance helicopter crash,1
271,ambulance,Happily Married with 2 kids ,ambulance sprinter automatic frontline vehicle choice of let compliant bay,0
272,ambulance,Happily Married with 2 kids ,ambulance sprinter automatic frontline vehicle choice of let compliant bay,0
273,ambulance,Loveland Colorado,check out whats in my parking lot he said that until last year it was an ambulance in st johns,0
274,ambulance,|| c h i c a g o ||,when you dont know which way an ambulance is coming from lilt,1
276,ambulance,,reuters twelve feared killed in pakistani air ambulance helicopter crash,1
277,ambulance,L. A.,twelve feared killed in pakistani air ambulance helicopter crash,1
279,ambulance,,why is there an ambulance right outside my work,0
280,ambulance,Canada,a this dog thinks hes an ambulance,0
281,ambulance,VISIT MY YOUTUBE CHANNEL.,happening now hatzolah ems ambulance responding with dual sirens and,0
283,ambulance,Lexington,twelve feared killed in pakistani air ambulance helicopter crash,1
285,ambulance,,twelve feared killed in pakistani air ambulance helicopter crash,1
287,ambulance,USA,twelve feared killed in pakistani air ambulance helicopter crash worldnews,1
289,ambulance,"Hannover, Germany",twelve feared killed in pakistani air ambulance helicopter crash worldnews,1
290,ambulance,,whats the police or ambulance number in lesotho any body know,0
291,ambulance,,i am surprised we still cannon standardised the clinical practice across the nhs ambulance trust,0
293,ambulance,Playa,twelve feared killed in pakistani air ambulance helicopter crash,1
294,ambulance,"Davidson, NC",people who try to walk while an ambulance is passing i hate you,0
296,annihilated,Higher Places,the episode where trunks annihilated freeze is the cleanest shit ever he showed that nigra no mercy,0
297,annihilated,"Horsemind, MI",they shall be annihilated and all of their petebests dedicated and laid bare then you shall kneel before me,0
298,annihilated,"New York, NY",uribe just annihilated that baseball mets,0
299,annihilated,Boksburg,heysundowns were annihilated in their previous meeting with celticindeed its an improvement,0
301,annihilated,,rizzo has annihilated florida the past seasons even ended muschamps career just cant compete with mama,0
302,annihilated,,annihilated abs,1
303,annihilated,,be annihilated for status education mba on behalf of a on easy street career erm,0
307,annihilated,"V-RP @OZRP_ ?MV, AU, R18+?",to luka they should all die all of them everything annihilated alois tracy,0
309,annihilated,"Greater Manchester, UK",have a good un fella sorry i wont be there to get annihilated with you,0
310,annihilated,Boston,cop pulls drunk driver to safety seconds before his car is hit by train via,1
312,annihilated,,you must be annihilated,0
313,annihilated,,cop pulls drunk driver to safety seconds before his car is hit by train via,1
314,annihilated,The Canopy Kingdom,boom your country was just entirely annihilated by a he a britain,0
315,annihilated,,you would have been annihilated so you might as well thank,0
316,annihilated,USA,one thing for surgeon has promised israel will not be annihilated buttle horror of iran snakes,0
318,annihilated,,i guess thats ok for armenians since were spent most of our history getting annihilated,1
320,annihilated,,years since we annihilated people instantly and became aware that we have the ability to annihilate the whole of humanity,1
321,annihilated,the own zone layer ,day of trout went good minus the fact i stopped quickly to get a short ball and annihilated my toenail injury even more,0
322,annihilated,London,during the the oryx a symbol of the arabian peninsula were annihilated by hunters,1
327,annihilated,Trancy Manor,to luka they should all die all of them everything annihilated alois tracy,0
328,annihilated,,ready to get annihilated for the bus game,1
329,annihilated,South 37,people annihilated by last nights weather really philip thought you would have forecast that,1
330,annihilated,,domain other sophistication be annihilated closely uptotheminute feat znf,0
331,annihilated,"West Lancashire, UK.",i seen judas priest in when rob came back scorpions as support fucking annihilated the place astonishing gig,0
332,annihilated,PA,officially skipping out on fantasticfourwhatever the hashing is its getting annihilated in reviews bummer,0
334,annihilated,,thus explaining why you were all annihilated but the few or in this case you the only survivor evolved and became godlike,1
335,annihilated,ÂÃÂ¢ Views From The Six ÂÃÂ¢,just completely annihilated czech with paul keegan what a time to be alive,0
336,annihilated,,who then were annihilated by the legion itself the survivors of the imperfect hybrid project quickly formed a new secret cell,0
337,annihilated,University of Toronto,exactly thats why the lesnarcena match from summerslam last year was so great because brock annihilated a guy whos,0
338,annihilated,,cop pulls drunk driver to safety seconds before his car is hit by train via,1
340,annihilated,Swaning Around,annihilated in damascus syrian army grinds ñalloosh and his gang into the manure pile,1
341,annihilated,,ok i wasnt completely forthright i may have also been in a food coma bc of the kebabtahinipickles i also annihilated fries,0
344,annihilated,London,a fun filled happyhour at simmons bar in camden with this handsome one i got annihilated apart from this game,0
345,annihilated,Albany/NY,funny bristol sr annihilated that ball lgm,0
346,annihilation,"California, USA",hell is just a fraction of his belief of total annihilation destruction of usa,1
347,annihilation,,maybe we should call israel and tell them were sorry are pres has sold them down the river to annihilation,0
348,annihilation,,evildead annihilation of civilization,0
349,annihilation,,us national park services tonto national forest stop the annihilation of the salt river wild horse via,0
352,annihilation,Wild Wild Web,annihilating quarterstaff of annihilation,1
353,annihilation,Subconscious LA,world annihilation vs self transformation aliens attack to exterminate humans,0
354,annihilation,Spain,starmade stagnate planetary annihilation via,1
355,annihilation,,us national park services tonto national forest stop the annihilation of the salt river wild horse via,0
356,annihilation,CA physically- Boston Strong?,us national park services tonto national forest stop the annihilation of the salt river wild horse via,1
358,annihilation,"Yeezy Taught Me , NV",can you please sign and share this petition to save wild horses in arizona,0
360,annihilation,,us national park services tonto national forest stop the annihilation of the salt river wild horse via,1
361,annihilation,CA physically- Boston Strong?,please check into salt river horses help stop the annihilation about to happen without more signatureschange org the,0
363,annihilation,United States,are souls punished withñannihilation,0
364,annihilation,,not to mention a major contributor to the annihilation of israel,1
365,annihilation,,we need help horses will displease rt amp sign petitiontake a stand amp be a voice for them,1
368,annihilation,"Rock Hill, SC",i reject the laws of the misguided false prophets imprison nations feeling self annihilation,0
370,annihilation,"Coolidge, AZ",us national park services tonto national forest stop the annihilation of the salt river wild horse via,0
371,annihilation,Republic of Texas,the annihilation of job christie amp basic is less than hours away please god allow me at least one more full day,0
372,annihilation,,we need helphorses will die please rt amp sign petition take a stand amp be a voice for them,0
