id,keyword,location,text,target
2912,danger,Worldwide,check out this rocking preview of danger zone coming soon artistsunited,0
2913,danger,"Loughborough, England",what is this like i could be in danger or something,1
2915,danger,Killarney,when the last tree is cut down the last fish eaten and the last stream poisoned you will realize that you,0
2916,danger,"Brooklyn, NY",my take away preservation parks r an imposition amp a danger to african people i never imagined,0
2917,danger,Lahar & Gwalior,indian govt amp media should take serious concern about their safety they are in danger now,1
2920,danger,"St Paul, MN",training grains of wheat to bare gold in the august heat of their anger im the no trespass lest you seek danger,0
2921,danger,Atlanta Georgia ,fettilootch is slanglucci oppressions greatest danger coming soon the album,0
2922,danger,,it appears our govt has lost an ethical and or moral relevance this means the whole usa population is in danger from them,0
2924,danger,"Lincoln, IL",dont like those head first slides especially into home danger,0
2925,danger,World,permits for bear hunting in danger of outnumbering actual bears the licenses for florida fir st petersburg,0
2927,danger,Spinning through time.,and not too much danger please,0
2929,danger,Atlanta Georgia ,fettilootch is slanglucci oppressions greatest danger coming soon the album,1
2931,danger,"Boston, MA",is looking to repair its recent bad rap with some nonprofit partnerships,0
2932,danger,Hailing from Dayton ,i wish i could get victoria secret on front im good for it,0
2933,danger,Worldwide,check out this rocking preview of danger zone coming soon artistsunited,0
2934,danger,"Newcastle Upon Tyne, England",why would arsenal fans want that west ham will be in a relegation battle this season no danger for afc on sun,0
2935,danger,Atlanta Georgia ,fettilootch is slanglucci oppressions greatest danger coming soon the album,0
2936,danger,Atlanta Georgia ,fettilootch is slanglucci oppressions greatest danger coming soon the album,0
2937,danger,,the danger and excitement of underwater cave diving,0
2939,danger,,the girl that i wanna save is like a danger to my health try being with somebody that wanna be somebody else,0
2941,danger,Instagram: trillrebel_,guns are for protection that shit really should be used unless your life in danger,0
2942,danger,ALWAYS DYING NEVER RESTING,so thirsty all in danger of dehydration,1
2943,danger,"San Jose, CA",thunderstorms with little rain expected in central california high fire danger weather cabx,1
2944,danger,2005 |-/,i wanna get a danger days tattoo so bad how cool would that spider look like on someone wrist or smith,0
2945,danger,Israel,in my experience if your always angry and critical as a pundit you are in grave danger of going off the rails,0
2946,danger,Uruguay / Westeros / Gallifrey,i am not in danger styler i am the danger,0
2947,danger,"Kansas City, MO",too dangerous for them but its ok for the rest of us to be in danger,0
2948,danger,"Silver Spring, MD",investigate why robert mueller dint respond to my complaints since nov amp just left meson out her in danger,0
2950,danger,Jersey - C.I,honestly tho modify amiga is stealing a living fuck all about him im past my best but still more of a danger than that fucktard coli,1
2952,danger,,fear has a way of making us see danger where there is none contemplating the logic behind the situation and find the courage to engage it,0
2953,dead,,joel and book of acts,0
2954,dead,Afghanistan,dead as afghanistan aircraft crashes an afghan military helicopter has crashed in a remote region of the s,1
2955,dead,Sweden,why not even more awesome norse landscapes with loads of atmosphere and life than boringdead snotgreen wastelands,0
2956,dead,,i miss my longer haircut it was so dead anyways it wasnt even hair,0
2957,dead,,of presuppose reborn has attained individual rightsgenerally court law forbids killing unless dead person did something,0
2959,dead,London,remember that time you gave life to a dead bird what the hell you,0
2960,dead,"Orlando, FL",nasa i bee dead like a legit zombie i feel every sore part in my body,0
2963,dead,,we just happened to get on the same road right behind the buses im dead serious,0
2965,dead,Atmosphere,mao fucking luis hhahaha im dead,0
2969,dead,,i just watched emmerdale nd i dont know who most of them are but a slightly attractive man named ross just got beat up nd now hes dead,1
2970,dead,Glasgow,i need you to confirm that ross is dead cause i dont trust anyone else oh,0
2971,dead,,iwasdisappointedby telltale the walking dead good characters amatory but no real gameplay and too many performance issues,0
2973,dead,,beforeitsnews hundreds feared dead after libyan migrant boat capsized during rescue a,1
2974,dead,somewhere in Portugal,if its a war you came to see you will never see a waved white flag in front me i cant end up dead i wont be misled,0
2975,dead,South Stand,oh fuck sake he is dead,0
2976,dead,dundalk ireland,is ross really dead askcharley,0
2980,dead,,don avoid wearing dead black flaming red and stark white so much and esp at debate go with your blue gold brown even to shoes and,0
2982,dead,,perspectives on the grateful dead critical writings contributions to the study,1
2983,dead,"Sochi, KDA, RU",hello im looking for mod cold ice i saw it on your site but link to download dead maybe you have it and share with me thanks,0
2984,dead,"ÃÃT: -26.695807,27.837865",lmaovv hard the ny is the the new trend babalmaowelcome to nazi kwaaaaadead,0
2987,dead,South Stand,now ive said all this hes dead and no one else dies,0
2988,dead,You're not 19 forever   ,is ross dead noooooooooooo,0
2990,dead,"Kettering, OH",thinking of the time that my friend bailed the nite a dead showmen alone amp had a great time all alone and free to dance front row,0
2991,dead,United States,typhoon soudelor taking dead aim at taiwan,1
2992,dead,,askcharley emmerdale how emotional are you that ross is dead,0
2993,dead,Planet Earth,man found dead in demi moores swimming pool,1
2995,dead,Spare 'Oom,thats it val is dead im suing,1
2998,dead,,he is dead,0
3000,dead,United States,wormwood road of the dead was fucking awesome and it had an awesome ending too awesome one,0
3001,dead,Milton Keynes ,cant believe ross is dead emmerdale summerfate,0
3003,death,,i will only call or text nights my off amp my boyfriend i love my boys to death no other nights can hold my attention like them,0
3004,death,ATL??AL??,i hate to talking top with my grandma i mean i love her as to death but she talk so damn much ssshhheeesshh,0
3005,death,UPTOWN ,until my death ill forever rep the jets,1
3006,death,,my vibrator shaped tape done busted,0
3009,death,PROV,death threats on a nigra life well then we gon see,0
3010,death,"Novi, MI",adult dies of plague in colorado,1
3011,death,New York,box pro console red ring of death full read by bay,0
3012,death,"Buenos Aires, Argentina",going back to janesville will be the death of me,1
3013,death,on the go,a year later ferguson sees change but asks if its real,0
3014,death,,papiichampoo what i enjoy most about the ibama era is the civility prey says got supports iranian death to,0
3015,death,,i feel like death,0
3016,death,The UK,i liked a video from dj hazard death sport,0
3018,death,,i tell my cousins i dont wanna hang out and they text me saying were coming over honestly do you have a death wish,0
3019,death,,rss judge orders texas to recognize spouse on same-sex death certificate,0
3021,death,mpls. ,her loyalty mission involves her kicking a shitty nobleman to death i love this elven weirdo,0
3022,death,"Kensington, MD",there is a way which seemeth right unto a man but the end thereof are the ways of death,1
3023,death,Buffalo/DC,thanks i narrowly averted death that was fun your right,1
3025,death,,katherine death,0
3026,death,"Sylacauga, Alabama",death to muslims,1
3027,death,,going to starve to death,0
3029,death,,ted cruz bashes ibama comparison got to iranians shouting death to america,0
3030,death,,katherine death,0
3034,death,,new crime knowing your rights punishable by death,0
3036,death,USA,i had no issues unloading death to smoochy or awakenings clips to but for some reason bicentennial man is being a pain in the ass,0
3037,death,To The Right of You!,ted cruz bashes ibama comparison got to iranians shouting death to america cot,1
3038,death,Cyprus,cyprus news analysis mullah mars death may split italians ranks mars demise would certainly lead,1
3039,death,kansas,i feel like deathly moles,0
3042,death,"Los Angeles,CA, USA",video slain mexican journalist unknowingly predicted his own death via,0
3043,death,"Portland, OR",there is this old lady rocking out to death metal in her sedan downtown smoking a cigarette i found my real mom,0
3044,death,Carry On Jutta!!!,afghan peace talks in doubt after mullah mars death financial times mullah,0
3045,death,Home of the Takers.,all pusssssssssy and shook to death of me,0
3047,death,"New York, New York",the first trial in the death of cecilthelion was just postponed,0
3048,death,,years ago this week is the anniversary of marilyn monroe death ripriprip,0
3049,death,?s????ss? a?????,aris hints and snippets will be the death of me,0
3051,death,Chicago,tomorrow will be the death of me,0
3052,death,"Alicante, Spain",new nec legionnaires disease death toll rises follow,1
3053,deaths,,vaxshill deaths from measles complications in yrs everyone looses their shit dead from legionnaires in a month amp crickets,1
3054,deaths,,bigamist and his first wife are charged in the deaths of his second pregnant wife her child her mother her nephew and their up,0
3055,deaths,"Mooresville, NC",dont get on south huge wreck and airlift and maybe some deaths interstate is completely blocked,1
3056,deaths,"Mooseknuckle, Maine",a cases of voter fraud a year we need new laws gun deaths a day who actually follows laws emirate a,1
3057,deaths,"Palermo, Sicily",silence palermo shipwreck children deaths,1
3058,deaths,,this why osf japan died fedayeen has as and they bloody incas incas rifles not to blame for soldiers deaths mod,1
3059,deaths,AsunciÃ_n-PY / TÃ_bingen-GER,breast milk is the original superfund but rates worldwide have stalled below contributing to more than child deaths last year,0
3060,deaths,"Voorhees, NJ",of the deaths in red-light running crashes are pedestrians cyclists amp other vehicle occupants that are hit by the red-light runners,1
3061,deaths,,rt deaths per year from physician error how to avoid being one of them,1
3062,deaths,,cdcwhistleblower deaths from measles complications in yrs everyone looses their shit dead from legionnaires in a month amp crickets,1
3064,deaths,,bigamist and his first wife are charged in the deaths of his second pregnant wife her child her news,0
3066,deaths,UK,deaths a year from foodborne illness dears,1
3068,deaths,"Atlanta, GA",hear talk on how to avoid thousands of resistant infectionsdeaths in next yrs adiossuperbacterias,0
3070,deaths,Planet Earth,irony just died a thousand deaths,0
3071,deaths,Wakanda,lol usually but im being objective here maybe uncle ben of course most deaths end up business as usual,0
3072,deaths,Lagos,comment deaths of older children what do the data tell us nghlth,1
3073,deaths,Does it really matter!,deaths,1
3074,deaths,,we will never know what would have happened but the govt seemed to think that their beliefs warranted the deaths of innocent japs,1
3075,deaths,Your screen,real magic in real life women went missing in ohio town the focus of fbi probe after strange deaths and,1
3077,deaths,"Phoenix, AZ",no two cases dont constitute an epidemic plague health publichealth,1
3079,deaths,Does it really matter!,deaths,0
3080,deaths,Edinburgh,had lunch with stewart amp julian only a couple of hours earlier good to finally find out what happened to them,0
3082,deaths,Weyburn,reyburn police warn public after fentanyl deaths in province,1
3083,deaths,UGA '15 Alumnus - Economics ,none of you annoying crusty all lives matter head ass people ever actually support causes you just hate when black deaths get attention,0
3084,deaths,,its time to reduce gun deaths,1
3085,deaths,,amp the stat of high auto deaths applies to children in a vehicle i guess they can out run lightrail better than adult,0
3086,deaths,Blackpool,cancers equate for around of all deaths in blackpool knowing the signs could save your life beclearoncancer,1
3089,deaths,"the void, U.S.A",a reverse situation lol i dont know where us civilian deaths were specifically utilized to make a political,1
3090,deaths,london town..,heard theres two more deaths and a murder chrissie kills adam val and finn die emmerdale,0
3091,deaths,Tennessee/Gallifrey,they died horrible deaths trapped in the ships but they knew that was a risk,1
3092,deaths,"Amman, Jordan",co minister condemns attack at a mosque in saudi arabia that has resulted in at least deaths,1
3093,deaths,Blackpool,cancers equate for around of all deaths in blackpool knowing the signs could save your life beclearoncancer,1
3095,deaths,"Washington, D.C.",fritters climate and two plague deaths in colorado,1
3097,deaths,,since the year angela sanders was born roundhouse kick related deaths have increased percent,1
3099,deaths,"Columbia Heights, MN",wal-mart is taking steps to keep children safe in hot vehicles take a look at the innovative car seat here,0
3100,deaths,Top Secret,as of there were beluga deaths reported at seaward their average age years opseaworld,1
3101,deaths,"ÃÃT: 10.614817868480726,12.195582811791382",bigamist and his first wife are charged in the deaths of his second pregnant wife her child her mother,1
3102,deaths,Top secret bunker ,pls reduce cyclist deaths with a compulsory highway code test as with every other vehicle that uses a road notrocketscience,1
3104,debris,"Belbroughton, England",aerospace exec plane debris is from missing part of the aircraft wing found on reunion island is from th,1
3105,debris,,malaysia airlines flight that disappeared ago debris found south of the indian ocean,1
3106,debris,,aircraft debris found on la reunion is from missing malaysia airlines,1
3107,debris,772 Temperance Permenence,discovered plane debris is from missing malaysia airlines flight time,1
3108,debris,,confirmed the debris from,1
3109,debris,,aircraft debris found on la reunion is from missing malaysia airlines,1
3111,debris,Nigeria ,malaysia confirms plane debris washed up on reunion island is from flight,1
3112,debris,,aircraft debris found on la reunion is from missing malaysia airlines,1
3114,debris,"46.950109,7.439469",how missing jets debris could have floated to reunion the new york times,1
3115,debris,,reunion debris is almost surely from flight officials say new york times,1
3116,debris,,reunion debris is almost surely from flight officials say new york times,1
3117,debris,In the Shadows,the debris found on reunion island was from flight the mystery behind that plane disappearance could be better than any novel,1
3118,debris,,aircraft debris found on la reunion is from missing malaysia airlines,1
3119,debris,Campo Grande-MS,reuters debris confirmed from relatives hope for discovery of crash site,1
3120,debris,nbc washington,nbcnightlynews malaysian officials say debris found on reunion island is from billneelynbc reports,1
3122,debris,,debris found on reunion island sad tragedy innocent crash,1
3123,debris,Seattle,love food fun malaysian prime minister najib razak confirmed that the aircraft debris found on reunion isla,1
3124,debris,"Hamilton, Ontario Canada",malaysia seem more certain than france plane debris is from missing,1
3125,debris,New York,malaysian officials say debris found on reunion island is from reports,1
3126,debris,,aircraft debris found on la reunion is from missing malaysia airlines,1
3130,debris,,debris found on reunion island comes from malaysian pm,1
3131,debris,,aircraft debris found on island is from malaysia confirms,1
3132,debris,"Dubai, United Arab Emirates",what irony debris of flight found on reunion island,1
3133,debris,India,aircraft debris found on la reunion is from missing malaysia airlines abc online,1
3134,debris,Hong Kong,reunion debris is from missing malaysia flight,1
3136,debris,"Berlin, Germany",experts leave lab as malaysia confirms debris is from,1
3137,debris,Nigeria ,malaysia confirms plane debris washed up on reunion island is from flight,1
3138,debris,IRAQ,kamindoz reuters debris confirmed from relatives hope for discovery of crash s,1
3139,debris,,plane debris discovered on reunion island belongs to flight a malaysian pm,1
3140,debris,"Tampa, FL",debris confirmed from relatives hope for discovery of crash site malaysian officials confirm a breath,1
3141,debris,World news,abc aircraft debris found on la reunion is from missing malaysia airlines abc online piece of aircraft debris which,1
3142,debris,Hong Kong,malaysia confirms reunion island debris is from,1
3144,debris,,debris confirmed from relatives hope for discovery of crash site via video,1
3145,debris,Hong Kong,plane debris is from missing,1
3147,debris,,aircraft debris found on la reunion is from missing malaysia airlines abc online g malaysia news,1
3150,debris,"Bristol, UK",interesting aircraft debris found on la reunion is from missing malaysia airlines abc please rt,1
3152,debris,"labuan, malaysia",aircraft debris confirmed to be from nation the star online,1
3153,deluge,United Kingdom,ah i was awash with abstract dustin sweets then explains the deluge,0
3154,deluge,right next to you,my bet is mother nature might have plans to send a deluge our way,0
3155,deluge,CT ? NYC,my feed seems to have a deluge once or twice during the week its fantastic,0
3157,deluge,www.tmgcgart.com,most welcome organizing twitter to find the important stuff amongst the deluge btw loving the music and signed up for the ep,0
3158,deluge,,niagara falls package deals deluge tours yes,0
3159,deluge,"London, England",i apologise sincerely for the inevitable deluge of ebbo sweets to come i wont hold any grudges if you decide to follow baking cakes,0
3161,deluge,"Los Angeles, CA",rt a deluge of resources on floods for medical providers cleanup workers amp more at,1
3162,deluge,,topcoat trek sympathy deluge falls etc,1
3163,deluge,,a deluge of eulogies for cecilthelion on my whatsapp gtgtthis too tormented soul by matins xavier,0
3165,deluge,Australia,wa smiles after july deluge the west australian via,0
3166,deluge,Brisbane,china is only delaying the deluge if the fundamentals of an economy do not support the valuations of a stock,0
3167,deluge,Melbourne-ish,despite the deluge of fantasticfour notices our man ocean is still buying tickets because hes bloody-minded like that,0
3168,deluge,617-BTOWN-BEATDOWN,photo forrestmankins colorado camping,0
3170,deluge,"Brackley Beach, PE, Canada",its a deluge in troisrivieres about one hour to get to legionstrackandfield,0
3171,deluge,London,why so many half-naked men on twitter tonight normally id embrace the odd torso but the scale of tonights deluge is unprecedented,0
3172,deluge,518,yes man i was having a bad week so far but events a deluge of fans have turned it right around,0
3173,deluge,"Nottingham, England",best windows torrent client was recommended deluge but it looks like it was written years ago with java swing and uses worse,0
3174,deluge,eARth 3,the fifth predynastic king in the legendary period before the deluge dumuzid the shepherd,0
3175,deluge,,i am for the deluge of hell vines,0
3176,deluge,,strange to caustic geography portion him till give voice deluge byityf,0
3177,deluge,"Enniscrone & Aughris, Sligo ",back on the beach after the deluge surf camp in motion our surf therapy programme kicked off today for,1
3179,deluge,"Mostly Wellington, NZ ",light rain was the forecast i based my dressing on light rain not incessant deluge,0
3180,deluge,London,perhaps historic should be applied not to the deluge of recently exposed childsexabuse but the truly historic scale of the cover-up,1
3181,deluge,,the bible sometimes backs up the truck and unload a descriptive deluge of indecency on us explains why on next,0
3182,deluge,USA,audio business owners share what they would do differently,0
3183,deluge,,whole slew of updated posts coming now that the hosting is fixed until deluge,0
3184,deluge,617-BTOWN-BEATDOWN,photo bauhaus heaven sent by jake after a very warm morning on montanas madison river a early evening,0
3185,deluge,,the camp things i do for gishwhes just got soaked in a deluge going for pads and tampons the,0
3186,deluge,,deluge is such an awesome word no idea why i like it so much,0
3188,deluge,,wrinkled the face of deluge as decayed,0
3189,deluge,,thanks im teaching an online class amp asking my students lots of questions like this sorry for the deluge of ren art,0
3190,deluge,"Atlanta, Ga",only showman can save the big easy from a deluge of supernatural monstrosities read free,0
3191,deluge,World,houghjeff crap the content marketing deluge by dougkessler via slideshare contentmarketing,0
3192,deluge,,i love the song healing is heredeluge implanted to sing it at my church but its not in spanish so i translated it,0
3193,deluge,"Fort Fizz, Ohio",vince mcmahon once again a billionaire i remember reading a deluge of posts about vince mcmahon losing m,0
3195,deluge,"New York, NY",nfl playing deflategate perfectly the deluge of incremental stories has bored the world into not caring and just wanting it to go away,0
3196,deluge,"Fort Lauderdale, FL",if your in search of powerful content to improve your business or have been frustrated with the deluge of quantity,1
3197,deluge,Raleigh (Garner/Cleveland) NC,whats missing in the exhibitor email value assnchat,0
3198,deluge,,meditationbymsg ppl got method of meditation in up maggot deluge of divine blessing happy n peaceful life,0
3199,deluge,Newcastle upon Tyne,here im the uk there int a deluge of canadian themed tops aroundthe timing was perfect i cant quite believe it mad,1
3200,deluge,walking the tightrope,tomorrow is internet day it has been almost months i look forward to the deluge of stuff ive been avoiding a downright lie,0
3201,deluge,Frascati,novalismi joseph mallard william turner shade and darkness the evening of the deluge click sul title,0
3205,deluged,"College Station, TX",anyone else getting tons of telemarketing calls on their cell phone ive been deluged,0
3210,deluged,"Bishops Lydeard, England",im sure the shop is deluged by local children wanting to buy it really,0
3211,deluged,,businesses are deluged with invoices make yours stand out with colour or shape and its likely to rise to the top of the pay pile,0
3212,deluged,"Karachi, Pakistan",glimpses hyderabad deluged by heavy rainfall,1
3216,deluged,,businesses are deluged with invoices make yours stand out with cold r or shape and its likely to rise to the top of the pay pile,0
3217,deluged,Up a hill,also in a matter of weeks amazons going to be deluged with poorly written indie dystopian fiction about teens escaping from blood farms,0
3218,deluged,,businesses are deluged with invoices make yours stand out with colour or shape and its likely to ris together top of the pay pile,0
3219,deluged,,businesses abe deluged with invoices make yours stand out with colour or shape and its likely to rise to the top of the payable,0
3221,deluged,London,why are you deluged with low self-image take the quiz,1
3222,deluged,,businesses are deluged with invoices make yours stand out with colour or shapland its likely to rise to the top of the pay pile,0
3225,deluged,"Clearwater, FL",the reason i bring this up bc he is running senate murphy is nothing but a republican i am deluged with his junk mail,0
3227,deluged,Manchester,why are you deluged with low self-image take the quiz,0
3229,deluged,Wellington,whoever holds the address rockface is going to be deluged in spam meant for me,0
3231,deluged,,tap is protecting outfield and cannon be moved anfield getting deluged,1
3235,deluged,,businesses are deluged with inroicesmake yours stand out with colour or shape and its likely to rise to the top of the pay pile,0
3236,deluged,#????? Libya#,eu states squabble over immigration france eurotunnel deluged with migrants one dead as thousands storm tunnel,1
3237,deluged,,businesses are deluged with invoices make yours stand oup with colour or shame and its likely to rise to the top of the pay pile,0
3239,deluged,,businesses are deluged with invoices make yours stand out with colour or shape and itsllikely to rise to the top of the pay pile,0
3240,deluged,,businesses are deluged with invoices make yours stand out with colour or shape and its likely to rise to the top of t e pay pile,1
3241,deluged,,the us department of commerce has been deluged the last two months with com a,0
3242,deluged,Newcastle,do you feel deluged by low self-image take the quiz,0
3243,deluged,,businesses are deluged with invoices make yours stand out with colour or shape and its likely to rise to the top of the pay pile,0
3244,deluged,,businesses aredeluged with invoices make y us stand out with colour or shape and its likely to rise to the top of the pay pile,0
3245,deluged,"Los Angeles, CA",forgive me if i was a bit testy have been deluged with hatred amp have lost patience,0
3248,deluged,Pakistan,news alerts glimpses hyderabad deluged by heavy rainfall,1
3249,deluged,balvanera,afterwards i had to be alone for an hour to savour and prolong the almost physical intensity of the feelings that deluged me y sigue,0
3252,deluged,Aro Diaspora,they come back ggt flying ant day capital deluged by annual swarm of winged insects,1
3253,demolish,Washington D.C.,rand pauls debate strategy demolish some other bad ideas out there or point out maybe that there are some em,1
3255,demolish,"Nigeria, WORLDWIDE",enough government to demolish illegal structures at international conference centre,0
