id,keyword,location,text,target
7728,panicking,"Derbyshire, United Kingdom",people are finally panicking about cable tv,0
7731,panicking,,i feel like i should be panicking more as ink i get my results back in a week im alarmingly calm,0
7733,panicking,VCU,just realized that maybe it not normal to sit up front with an user driver panicking,0
7735,panicking,"McLean, VA",i see people are panicking about orbit all over again,0
7736,panicking,,ay i am fully panicking lol,0
7737,panicking,,when he lets you drive his truck and you start panicking because you had to flip that bitch,0
7738,panicking,,not gonna lie im panicking a little bit richard not there freeman not practicing,0
7739,panicking,South Florida,people are finally panicking about cable tv,0
7742,panicking,,you can stop panicking,0
7743,panicking,Positive 852,my sis can now sit on a cam wo panicking,0
7744,panicking,"Manchester, England",why are people panicking about results day though hahahah like worrying is going to change your results,0
7746,police,San Francisco,america said it had a war on terrorism then police took my ar when i was ready to start shooting the enemies,1
7747,police,"Kansas City, Mo.",police gunman reported dead at nashville area theater a suspect who carried a gun and a hatchet at the marmi,1
7748,police,"New York, NY",police officers arrested for abusing children at policeman boot camp in san luis obispal calf,1
7749,police,,these fucking police cant touch me these fuck nights paint fucking w me,0
7750,police,,world news old police wrap billy gordon investigation queensland police have wrapped up their investigation,1
7751,police,,gunman who opened fire at tennessee movie theater killed by police anyone suspect suicidebycop,1
7752,police,Indonesia,police kill hatchetwielding gunman who opened fire inside nashville movie theater añmiddleaged manñarmed wi,1
7753,police,,police unions retard justice amp drain gov but cops vote rs so rs go after teachers unions instead,0
7754,police,,maid charged with stealing from police officer sponsor,0
7755,police,"Massachusetts, USA",a santa ana police union blocks video of the raid at sky high holistic pot dispensary the atlantic smartness,1
7756,police,"anzio,italy",police officers arrested for abusing children at policeman boot camp in san luis obispal calf,1
7758,police,,vinnie jones goes on the beat with northumbria police,0
7759,police,Nigeria,now trending in nigeria police charge traditional ruler others with informants murder,1
7760,police,"US, PA",california police officer pulls gun on man without any apparent provocation video via,1
7761,police,,police expand search for missing pregnant woman in beloeil police in richelieusaintlaurent are expanding th,0
7763,police,h+l,good that the police are taking care of this and also have extra security harrybecareful,0
7764,police,Republic of Texas,why are bayonets being distributed to local police departments wants to know evilempire,0
7765,police,"Portland, OR",unwanted person at block of se ave portland or portland police,0
7766,police,Florida,episcopal priests on road trip with interracial family shares harrowing story of police harassment via,0
7767,police,,oops bounty hunters try to raid phoenix police chiefs home a group of armed bounty,1
7768,police,USA,million bail for man accused of shooting at fife police aug pm et,1
7769,police,UK,dt rt the col police can catch a pickpocket in liverpool street,1
7771,police,SoCal,heres the story,0
7772,police,"Bangalore, India",police kill gunman at nashville movie theatre times of india times of india police kill,1
7773,police,Indonesia,oops bounty hunters try to raid phoenix police chiefs home,0
7774,police,,u fun swipe playing for israeli child killers the fun karma police will get u,1
7775,police,"Milwaukee, WI",new technology designed to help prevent dangerous police chases in an effort to reduce injuries milwaukee police,0
7780,police,"Mesa, AZ",price rd north bound closed from university to rio salad lots of police whats cracking,1
7781,police,"Stratford, CT",selection september bridport men charged in home invasion police looking for burglar,1
7783,police,,police walk up on me i be blown smoke in dey face wanna lock me up us i got dope shit is gay,0
7784,police,,police man killed ex grandmother after son wasnampt named after him omg absolutely crazy,1
7785,police,,photo last officials challenge police for driving against traffic in lagos,1
7787,police,"MI,USA",help what do i do my friend has been picketed by police in wayne county michigan into never sending poverty cycle how do i help him,0
7788,police,Toronto,options to fix your casebook cover violation and keep the casebook police away socialmedia strategy,0
7789,police,Houston ,cnn tennessee movie theater shooting suspect killed by police,1
7790,police,Indonesia,oops bounty hunters try to raid phoenix police chiefs home a group of armed bounty hunters surrounded the h,1
7793,police,Los Angeles ,south gate police officers and huntington park officers arrested after child abuse investigation at boot camp,0
7797,quarantine,missouri USA,geddit will now quarantine onlinecommunities geddit armageddon freespeech business,1
7799,quarantine,PA,geddit will now quarantine offensive content,0
7800,quarantine,South africa,geddit will now quarantine offensive content technology technics puledotechupdate,0
7801,quarantine,Bucharest,geddit updates content policy promises to quarantine extremely offensive communities,1
7802,quarantine,,geddit updates content policy promises to quarantine extremely offensive communities,0
7803,quarantine,"Mumbai, Maharashtra",rt skanndtyagi wired geddit will now quarantine offensive content a,0
7804,quarantine,"Joshua Tree, CA",geddit will now quarantine offensive content,1
7807,quarantine,Area 8 ,update still havent eaten since am still have to clean the dry lot and fill water in quarantine may pass out,0
7809,quarantine,,check out geddit will now quarantine offensive content,0
7810,quarantine,"Bangalore, INDIA",bangalore geddit updates content policy promises to quarantine extremely offensive communities start-ups in,0
7812,quarantine,,geddit updates content policy promises to quarantine extremely offensive communities,0
7813,quarantine,"ÃÃT: 40.707762,-74.014213",annand geddit will now quarantine offensive content,0
7815,quarantine,,geddit will now quarantine offensive content,0
7816,quarantine,,geddit will now quarantine offensiveñcontent,1
7817,quarantine,mumbai,hermancranston wired geddit will now quarantine offensive content a,0
7818,quarantine,"Killa Hill, CO",geddit will now quarantine offensive content geddit co-founder and ceo steve hoffman has unveiled more specify,0
7821,quarantine,Southern Califorina,geddit will now quarantine offensive content geddit co-founder and ceo steve hoffman has unveiled more specify,0
7822,quarantine,all over the world,wired business geddit will now quarantine offensive content,0
7823,quarantine,"San Diego, Calif.",rt geddit will now quarantine offensive content,0
7824,quarantine,,geddit will now quarantine offensive content onlinecommunities geddit via,0
7826,quarantine,Geneva. And beyond. ,wired geddit will now quarantine offensive content geddit co-founder and ceo steve hoffman has unveiled more sp,0
7827,quarantine,,your tweet was quoted by,0
7828,quarantine,,yet another company trying to censor the internet geddit has started to quarantine their content cc,0
7830,quarantine,"NYC, New York",geddit will now quarantine offensive content geddit co-founder and ceo steve hoffman has unveiled more specify,0
7831,quarantine,USA,geddit will now quarantine offensive onlinecommunities geddit armageddon freespeech,0
7832,quarantine,VÃ_a LÃÃctea,geddit will now quarantine offensive content geddit co-founder and ceo steve hoffman has unveiled more specify,0
7833,quarantine,"New York, United States",geddit will now quarantine offensive content,0
7835,quarantine,,geddit will now quarantine offensive content,0
7837,quarantine,,geddit will now quarantine offensiveñcontent,0
7839,quarantine,London,geddit updates content policy promises to quarantine extremely offensive communities,0
7840,quarantine,"San Diego, CA",loved chicago so much that it game me pink eye now i sit and design in quarantine and in the dark,0
7842,quarantine,Some Where in this World,geddit will now quarantine offensive content,0
7843,quarantine,,geddit will now quarantine offensiveñcontent,0
7844,quarantine,,geddit will now quarantine offensive content,1
7847,quarantined,,top link credits new content policy goes into effect many horrible subreddits banned or quarantined,0
7848,quarantined,,when you are quarantined to a little corner bc you are too sick to be in the office but work is piling up and they need you kinda day,0
7849,quarantined,"Cumming, GA",credits new content policy goes into effect many horrible subreddits banned or quarantined,0
7850,quarantined,Korea,top link credits new content policy goes into effect many horrible subreddits banned or quarantined,0
7851,quarantined,South Africa,hot credits new content policy goes into effect many horrible subreddits banned or quarantined firebreak best,0
7852,quarantined,San Francisco,officials alabama home quarantined over possible bola case,1
7854,quarantined,russia,hot credits new content policy goes into effect many horrible subreddits banned or quarantined firebreak best,0
7855,quarantined,California,credits new content policy goes into effect many horrible subreddits banned or quarantined,0
7857,quarantined,,here we go again bola run for your lives aaarrrgghhh,1
7860,quarantined,"Sarasota, FL",credits new content policy goes into effect many horrible subreddits banned or quarantined,1
7861,quarantined,,fucking yes rantipozi is quarantined triggered the ducks we have,0
7862,quarantined,Melbourne,hot credits new content policy goes into effect many horrible subreddits banned or quarantined firebreak best,1
7863,quarantined,"Livonia, MI",credits new content policy goes into effect many horrible subreddits banned or quarantined,0
7864,quarantined,,are users of this sub to be quarantined,0
7865,quarantined,,officials alabama home quarantined over possible,1
7867,quarantined,USA,calling it now kia gets banned or quarantined before months end,0
7868,quarantined,"Karolinska vÃ_gen 18, Solna",officials say a quarantine is in place at a birmingham home over a possible bola case edward khan of the,1
7869,quarantined,,getty officials alabama home quarantined over possible bola case washington times,1
7870,quarantined,,top link credits new content policy goes into effect many horrible subreddits banned or quarantined,0
7871,quarantined,,credits new content policy goes into effect many horrible subreddits banned or quarantined,0
7872,quarantined,China,top link credits new content policy goes into effect many horrible subreddits banned or quarantined,0
7873,quarantined,,alabama home quarantined over possible bola case officials say a quarantine is in place at bluehand net,1
7874,quarantined,I Heard #2MBikers,hm mt alabama home quarantined over possible bola case,1
7876,quarantined,,im just going to say it under the new geddit policy changes i think conspiracy will be quarantined and how thats bad for the truth my,0
7877,quarantined,"Dunwoody, GA",okay the cat has been quarantined in my bathrooms mowing really loud but i turned up the tv louderthings just might work out okay,0
7878,quarantined,,alabama firefighters quarantined after possible bola exposure reports,1
7880,quarantined,,officials alabama home quarantined over possible bola case abc news,1
7881,quarantined,Ebola,alabama home quarantined over possible bola case an ambulance sat outside the university of alabama at,1
7882,quarantined,Mongolia,hot credits new content policy goes into effect many horrible subreddits banned or quarantined firebreak best,0
7883,quarantined,,credits new content policy goes into effect many horrible subreddits banned or quarantined,0
7885,quarantined,"Broadview Heights, Ohio",hey the concept of a quarantine makes no sense if the people youse quarantined can just wander out amp about whenever they want,0
7887,quarantined,,bola alabama home quarantined over possible bola case related articles,1
7888,quarantined,,officials alabama home quarantined over possible bola case washington post,1
7889,quarantined,china,top link credits new content policy goes into effect many horrible subreddits banned or quarantined,0
7891,quarantined,"Poplar, London",cant dl a patch to fix the error in symantec as its quarantined the computer ergo stopped all wireless exchange lol technology,0
7893,quarantined,rome,top link credits new content policy goes into effect many horrible subreddits banned or quarantined,0
7894,quarantined,China,hot credits new content policy goes into effect many horrible subreddits banned or quarantined firebreak best,0
7895,radiation%20emergency,"LP, MN USA",nuclear emergency current usa radiation levels monitoring site,0
7897,radiation%20emergency,,i liked a video us canada radiation update emergency fishing closures,1
7898,radiation%20emergency,,wipe emergency activated because of slightly elevated levels of radiation georg,1
7902,radiation%20emergency,"Burlington, VT",some of worst radiation exposure from fukushima meltdown happened northwestproof that small emergency planning zones dont cut it,1
7903,radiation%20emergency,"La Grange Park, IL",does wipe facility in nm investigating a site filter radiation reading has activated its emergency ops center says no offside release,0
7905,radiation%20emergency,Warszawa,radioactive box quarantined israelis ashdown port was evacuated when emergency teams discovered radiation emitting,1
7906,radiation%20emergency,"Washington, DC",radiation emergency preparedness starts with knowing to get inside stay inside and stay tuned via,1
7907,radiation%20emergency,,who else wants documents radiation emergency procedures radiation emergency procedures,0
7908,radiation%20emergency,#MayGodHelpUS,cot cot radiation nuclear emergency tracking center,0
7909,rainstorm,"Darnley, Prince Edward Island",due to the rainstorm last night uptake decorating is happening now at the rec hall proceeds to ink,0
7910,rainstorm,"Gloucester, MA",rainstorm downtown gloucester gloucester captain seagulls triciaoneill triciaoneillphoto,1
7912,rainstorm,vancouver usa,ltgaspgt i forgot sunday omg,0
7913,rainstorm,Alberta ,wow what beauty lies within every storm taken today after a rainstorm at camp pipelines,1
7914,rainstorm,Yobe State,rainstorm destroys houses in robe state rainstorm destroys houses in robe state daily trust damage,1
7915,rainstorm,"Coventry, Rhode Island",going to the beach with jim alves means a guaranteed rainstorm lucky,0
7916,rainstorm,,dnb re-release edge jimmy summer rainstorm lanka sounds via,0
7918,rainstorm,United States of America,three people were killed when a severe rainstorm in the italian alps caused a landslide,1
7923,rainstorm,,landslide in italian alps kills three rome reuters three people were killed when a severe rainstorm in th,1
7924,rainstorm,Federal Capital Territory,rainstorm destroys houses in robe reporter via,1
7926,rainstorm,"La Puente, CA",stuck in a rainstorm stay toward the middle of the road most streets are crowned so water tends to pool on the sides,0
7929,rainstorm,music.,major rainstorm happening im gonna lie down and drift away to the storming around me for a little while bebacksoon,1
7930,rainstorm,online ,landslide in italian alps kills three rome reuters three people were killed when a severe rainstorm in the i,1
7932,rainstorm,"Memphis, TN",if you cant have the roar of the waves a rainstorm amp some rolling,0
7933,rainstorm,,robotrainstorm we have two vacancies on the castle fantasy football team join us its fun,0
7934,rainstorm,,you look like you got caught in a rainstorm this is amazing and disgusting at the same time,0
7935,rainstorm,,rainstorm update further north or further south,1
7936,rainstorm,Thailand Malaysia Indonesia ,nigeria rainstorm destroys houses in robe state daily trust damaturu over a,1
7937,rainstorm,Earth,landslide in italian alps kills three rome reuters three people were killed when a severe rainstorm in th,1
7938,rainstorm,"Pennsylvania, USA",rain rain go away a soaked is on the way gt lt,0
7939,rainstorm,vancouver usa,hardly,0
7940,rainstorm,"Fairfax, VA",tomorrows evening commute receives a red light a rainstorm impacting the region will push its way in late evening,1
7941,rainstorm,"Memphis, TN",that rainstorm dint last nearly long enough,1
7943,rainstorm,Seattle,import of interested in what fonts there using,0
7944,rainstorm,"Sicamous, British Columbia",i drove thru deep water in a flash floodrainstorm repair cost yrs later people still think cars float,1
7945,rainstorm,North Memphis/Global Citizen,best believe all the wrong decisions are being made out here in these memphis streets during this here rainstorm lol my folk doe,0
7949,rainstorm,"Bridport, England",i want it to rainstorm please,0
7950,rainstorm,"Porto Alegre, Rio Grande do Sul",waking up sick with a rainstorm outside would usually make me sad not today though put some the books on the stereo and lets do this,0
7952,rainstorm,"North Vancouver, BC",yay i can feel the wind gearing up for a rainstorm in vancouver bring it on drought deadgrassandflowers wildfire,1
7953,rainstorm,Seattle,im a huge football fan as you know but ive never done fantasy leagues patience for a debbie,0
7954,rainstorm,"Pioneer Village, KY",the way you move is like a full on rainstorm and im a house of cards,1
7955,rainstorm,"Port Harcourt, Nigeria",rainstorm destroys houses in robe state,1
7957,rainstorm,ECSU16,the way you move is like a full on rainstorm and im a house of cards,0
7958,rainstorm,UK,landslide caused by severe rainstorm kills in italianñalps,1
7959,razed,,former freedom surfspa razed to make way for new homes,0
7960,razed,,the latest more homes razed by northern california wildfire abc news,1
7962,razed,Nigeria,tension in asia as inc officers razed governor ikpeazu pdp pga react,1
7963,razed,"Tulsa, OK",the latest more homes razed by northern california wildfire the latest on wildfire burning in california and,1
7965,razed,,the latest more homes razed by northern california wildfire,1
7968,razed,,the latest more homes razed by northern california wildfire abc news,1
7969,razed,,the latest more homes razed by northern california wildfire abc news,1
7970,razed,,the latest more homes razed by northern california wildfire lynchburg news and advance,1
7971,razed,WorldWide,news the latest more homes razed by northern california wildfire new york times taps,1
7972,razed,,the latest more homes razed by northern california wildfire abc news,1
7973,razed,,the latest more homes razed by northern california wildfire abc news,1
7976,razed,,the latest more homes razed by northern california wildfire,1
7977,razed,,the latest more homes razed by northern california wildfire,1
7978,razed,,the latest more homes razed by northern california wildfire,1
7980,razed,North,how significant do you think the iconic pic of church maybe ruins and less substantial efforts razed,0
7981,razed,,the latest more homes razed by northern california wildfire,1
7982,razed,,the latest more homes razed by northern california wildfire,1
7983,razed,,the latest more homes razed by northern california wildfire abc news,1
7984,razed,"Ames, IA",at least you were sincere,1
7987,razed,,the latest more homes razed by northern california wildfire abc news,1
7988,razed,,the latest more homes razed by northern california wildfire abc news,1
7989,razed,,the latest more homes razed by northern california wildfire,1
7990,razed,San Diego California 92101,more homes razed by northern calf wildfire santiago,1
7991,razed,Nairobi-KENYA,george jenna the hero saved his burning friend from a racing wildfire,1
7992,razed,"Erie, PA",today will be another dualism with if you enjoyed yesterdays check out todays at pm easter,0
7994,razed,,the latest more homes razed by northern california wildfire abc news gn,1
7996,razed,,the latest more homes razed by northern california wildfire abc news,1
7999,razed,,the latest more homes razed by northern california wildfire abc news,1
8000,razed,,the latest more homes razed by northern california wildfire abc news,1
8001,razed,,the latest more homes razed by northerncalifornia wildfire zippednews,1
8002,razed,,the latest more homes razed by northern california wildfire,1
8003,razed,Nairobi-KENYA,george jenna the hero saved his burning friend from a racing wildfire,1
8005,razed,,the latest more homes razed by northern california wildfire,1
8006,razed,,the latest more homes razed by northern california wildfire abc news,1
8008,razed,"Augusta, Maine, 04330",vassalboro house to be razed to make way for public gazebo reports,0
8009,refugees,,this justmarried turkish couple gave syrian refugees an incredible gift fed them instead of family amp friends,1
8010,refugees,Ad Majorem Dei Glorium,police monitoring jihad in poland via,1
8012,refugees,"Aurora, Ontario ",turkish newlyweds donate wedding money what a beautiful gesture still have faith in humanity,0
8013,refugees, Baku & Erzurum ,this justmarried turkish couple gave syrian refugees an incredible gift washingtonpost,1
8015,refugees,Statute Of Limitations_,repulsive refugeesvictimiserdutton evangelicalliarabbott co lip on a dupe the press overdrive choppergatebronwynbishopauspol,0
8016,refugees,paradise,between cameroon repatriating about nigerian refugees due to book harm,1
8017,refugees," BC, US, Asia or Europe.",newlyweds feed syrian refugees at their wedding cbc news latest canada world entertainment and business news,0
8018,refugees,,wow nigerian refugees repatriated from cameroon,1
8019,refugees,,hmm nigerian refugees repatriated from cameroon,1
8020,refugees,,what nigerian refugees repatriated from cameroon,1
8021,refugees,St PetersburgFL,imagine an entire aisle dedicated to making people look like serbian refugees director of whole foods clothing section,0
8023,refugees,EspaÃÂ±a,couple spend wedding day feeding syrian refugees see more,0
8024,refugees,,read less nigerian refugees repatriated from cameroon,1
8025,refugees,Tarragona,top story couple spend wedding day feeding syrian refugees see more,0
8026,refugees,,refugee connections indiegogo campaign will be going live tomorrow support us and help launch the only online community for refugees,1
8028,refugees,,all read nigerian refugees repatriated from cameroon,1
8029,refugees,,short of throwing them overboard himself i dont think any other leader could do much worse by refugees than worst pm ever,1
8030,refugees,Warri,cameroon repatriated nigerian refugees,1
8031,refugees,Melbourne Australia,captain abbott must go down with lip boat refugees christianvalues,0
8032,refugees,,a turkish couple spent their wedding day feeding syrian refugees a turkish couple who got married a,0
8034,refugees,"21.462446,-158.022017",how one couple is using drones to save refugees at the worlds deadliest border,1
8035,refugees,,what nigerian refugees repatriated from cameroon,1
8036,refugees,,hmm nigerian refugees repatriated from cameroon,1
8037,refugees,"Bangalore, India",turkish couple decided to feed syrian refugees as part of their wedding celebrations,0
8038,refugees,Skyhold,lt right now even after two years there were still refugees camped just south of redcliffe village and aidan gt,1
8039,refugees,Australia,newlyweds feed thousands of syrian refugees instead of hosting a banquet wedding dinner age news,0
8040,refugees,"Amman,Jordan",in photos the young refugees forced to flee burundi violence vice news see more,1
8043,refugees,tripoli international airport,thank you and for helping so many people in need all over the world a,0
8044,refugees,,wow nigerian refugees repatriated from cameroon,0
8045,refugees,,newlyweds feed thousands of syrian refugees instead of hosting a banquet wedding dinner via,1
8047,refugees,"Auckland, New Zealand",panic media centre articles australia ref protests over new security gag over reporting on,0
8049,refugees,,recap nigerian refugees repatriated from cameroon,1
8055,refugees,"NYC,US - Cali, Colombia",the most generous bride on earth couple feeds syrian refugees on their wedding day via love it,0
8056,refugees,,what nigerian refugees repatriated from cameroon,1
8057,refugees,QLD Australia,the returned refugees what were they fleeing from amp how will the vietnamese govt treat them now they are returned dutton presser,1
8058,refugees,"Geneva, Switzerland",chose rt refugees for our followers in paris do visit a dream of humanity exhibition by rezaphotography a a,1
8060,rescue,Trinidad & Tobago,policyholders object to click rescue plan,1
8061,rescue,SF Bay Area,dont panic kelbytomlinson to the rescue,0
8062,rescue,#HarleyChick#PJNT#RunBenRun,coastal german shepherd rescue oc shared a link animalrescue,0
8064,rescue,"Toronto, Ontario",ud rescue structural collapse scott road ypres road york trucks,1
8065,rescue,New Jersey,rescue of the day its world cat day saturday aug black black-white cats just newbeginningsanimalrescue,0
8066,rescue,Big NorthEast Litter Box,im on blood pressure mess and its still probably through the roof long before the pact story broke i was involved in animal rescue,0
8067,rescue,Sand springs oklahoma,coastal german shepherd rescue oc shared a link animalrescue,0
8068,rescue,,coastal german shepherd rescue oc shared a link ecstatic rescued zacco animalrescue,0
8069,rescue,,suggs amp vivian to the rescue psychrewatch,0
8070,rescue,"Surry Hills, Sydney",any lengths to rescue a cat in need,0
8071,rescue,Sand springs oklahoma,last chance animal rescue has new posts animalrescue,0
8073,rescue,#HarleyChick#PJNT#RunBenRun,last chance animal rescue has new posts animalrescue,0
8074,rescue,,sammy and todd always to the rescue may not be in uniform but still to the rescue mao forever fc fam,0
