id,keyword,location,text,target
5280,fear,,fear couture,0
5281,fear,Stanford University,help me win by having the most shares on my article a lifetime of fear thanks blackinamerica growingupblack,0
5282,fear,Midwestern USA,we must refuse to become a nation with everyone living in fear of being shot unawares by intoxicated amor crazy people,1
5283,fear,Bedford IN ,horror films are made by incredibly creative artists we interviewed of them in depth for the anatomy of fear,1
5284,fear,,i want to be with you forever stay by my side on this special night fear and loathing in las vegassolitude xmas,0
5285,fear,"Thibodaux, LA",my worst fear,0
5286,fear,,im shaking in fear hes gonna hack the planet,0
5287,fear,Brazil,when the world say finish god says dont fear choosegod restoringpaths,0
5290,fear,In the moment,by replacing fear of the unknown with curiosity we open ourselves up to,0
5291,fear,,love god more than you fear hell,0
5292,fear,,dont tell the bride gives me the fear,0
5293,fear,Alliston Ontario,im forfeiting this years fantasy football pool out of fear i may win n get my ass kicked,0
5295,fear,,as of right now im reopening the files thats what they fear the most,0
5296,fear,SaudI arabia - riyadh ,live a balanced life balance your fear of allah with hope in his mercy and love for him,0
5297,fear,New York. NY,my biggest fear is that eventually you will see me the way i see myself,0
5298,fear,Athens - Nicosia,couples having less sex for fear till be a let down internet movies and books saying how sex ought to be p.,0
5299,fear,,nothing to fear its all about taking risks,1
5300,fear,Southern California,untangle yourself from requiring your partner to fill your needs and how to love without fear besttalkradio listen,0
5301,fear,"Bremerton, WA",the walking dead spin off fear the walking dead is on the,1
5302,fear,"Tulalip, Washington",i fear not for a while,0
5304,fear,Indonesia,the fear of the lord is the start of knowledge but the foolish have no use for wisdom and teaching amal,0
5305,fear,Halifax,the number of people denying climate change on the polar bear article makes me fear for the future of the us but also humanity in general,0
5306,fear,"Hilton Head, SC  ",gd ideas im worked hard now have almost nothing fear lives with poor fran reed,0
5308,fear,New York,never let fear get in the way of achieving your dreams deltachildren instaquote quoteoftheday disney waltdisney,0
5309,fear,"St. Louis, MO",fear is my motivator,0
5310,fear,USA,daily reflections august driven driven by a hundred forms of fear self-delusion self-seeking and self-pity,0
5313,fire,,organise gemstone white fire opal sterling silver ring size,0
5315,fire,SÃÂ£o Paulo,marquee como vista game of thrones kissed by fire bancodeseries,0
5316,fire,,save the date saturday august is the salisbury fire department open house at cypress st to,0
5317,fire,,why put out a fire when its still burning,0
5319,fire,2 high 2 come down ,cause were on fire we are on fire were on fire now yeah were on fire we are on fire were on fire nowwwwww,1
5320,fire,,my avi and header combo is fire,0
5321,fire,Wrex,auction shoes retro fire red,0
5322,fire,,my asshole is on fire,0
5323,fire,big boy ÂÃÂ¢ 0802,im crying that song just ended setting myself on fire,0
5324,fire,,setting things on fire is always an option,1
5325,fire,,sitting around a fire sounds great right about now,0
5326,fire,,i see fire,0
5328,fire,Brooklyn,but put flood of fire at the top of the list,1
5330,fire,Canada,im on fire,0
5331,fire,To The Right of You!,politifiact harry reid percent of women served planned parenthood claim is a pants on fire lie cot,0
5332,fire,"St.Cloud, MN",dear i brought it canonbringit fire canontattoo mn theresmorewherethatcamefrom,0
5335,fire,,yeah just who we need another middle class hating republican out to get hard working cops fire fighters teachers,0
5336,fire,,this fire is way too close wwf is going on,1
5337,fire,on a catwalk somewhere,fire meet gasoline always gotta get played twice lol,0
5338,fire,  Ã¥_ ,wow tha bitch is fire,0
5339,fire,Zac Newsome loves me,well it feels like im on fire,0
5341,fire,"louisville, kentucky",her eyes and words are so icy but she burns like rum on the fire,0
5342,fire,,news politifiact harry reid percent of women served planned parenthood claim is a pants on fire lie,0
5343,fire,,nothing like a good fire,1
5344,fire,Makai,tense activated yukio fire card,0
5345,fire,"Fort Valley,GA/Fayetteville,AR",california been shakingcatching on friend overcharging ppl on rent for the past years it paint going nowhere,1
5346,fire,Arizona,theres a fire in the catalina looks kinda cool this picture does do it justice,1
5347,fire,,dont overwork yourself your album is gonna be fire just dont overwork or stress i love you take care,0
5349,fire,"Vancouver, BC",i promise not to tax pancakes or rainbows or not dying in a fire,0
5350,fire,"Newark, NJ",this nigra chi diss was what meek was suppose to do this shit actually fire,0
5351,fire,the road to success,i wanna set some shit on fire,1
5352,fire,The Desert,in the words of charlie daniels fire on the mountain run boys run,1
5353,fire,"Sydney, Australia",i just checked in a at on fire on lovefood,1
5354,fire,"Yuba City, CA",when your heart is bigger than the obstacles in front of you euro dontexpectnothing july fire,0
5355,fire,,fire waves and darkness,0
5356,fire,University of South Florida,it may seem like our fire has been a little burnt out,0
5357,fire,,smelling a bon fire while driving makes me wanna be sitting near one making stores,1
5359,fire,the moon,will be dropping fire self tomorrow saying your welcome ahead of time,0
5362,fire%20truck,"Niagara Falls, Ontario",fire call brant av drummond rd for fire structure single units car on call truck,1
5365,fire%20truck,"Woodcreek HS, Roseville, CA",your psa for the day if a fire truck is behind you with lights going move over so they can get to their call,0
5366,fire%20truck,United States,rip fire truck service body for f fire fighting rescue amp safety equipment transport,0
5367,fire%20truck,,reno truck trailer catches fire in reno,1
5368,fire%20truck,,wild night in the village of pugwash every fire truck is out that the town has which is like a fire truck for every house population,1
5371,fire%20truck,Here & There,an wheeler came along and struck the fire truck spinning it around degrees and causing it to roll over,1
5372,fire%20truck,District 12 - Orange County,sigibert update n closed at fly fun trash truck fire,1
5373,fire%20truck,Plain O' Texas,dint look like a murder scene just cops a fire truck and fire assistance cars along with a helicopter,1
5375,fire%20truck,SouthEast Asia,former township fire truck being used in philippines langley times philippines,1
5377,fire%20truck,,former township fire truck being used in philippines township of langley assistant fire chief pat walker spen,1
5378,fire%20truck,,our garbage truck really caught on fire mao,0
5379,fire%20truck,,on northgate by the taco truck thats fire,1
5380,fire%20truck,,its never a good sign when you pull up to work amp theres five ambulances amp a fire truck in the bay wompppp at least its friday,1
5381,fire%20truck,"Saipan, CNMI",fire truck and ambulance in phase hope everyone okay prayforsaipan,1
5382,fire%20truck,"Orange County, Calif.",sigibert north amp southbound closed btw fly and irvine bled due to truck fire chp is devouring traffic,1
5383,fire%20truck,lost in my thoughts,true because of the truck that caught fire,1
5384,fire%20truck,,good xd i dint mean it so p but you have that fire truck in the back of you to make up for it so you good xd,0
5385,fire%20truck,Five down from the Coffeeshop,came across this fire video not mineenjoybabes way of saying hi to me while hes in the fire truck fireman a,0
5386,fire%20truck,Los Angeles,n past the l lane is reopened all other lanes are closed all lanes are open on the s trash truck fire cleanup,1
5387,fire%20truck,"Orange County, CA",sigibert north amp southbound closed btw fly and irvine bled due to truck fire chp is devouring traffic,1
5389,fire%20truck,Five down from the Coffeeshop,found this cool photo not mine dodge wayne bodied window bus ex libby mt fire department truck all ori,1
5391,fire%20truck,,trident chevy fire truck w jumper ims fire dept red ho plastic,0
5392,fire%20truck,"Tallahassee, FL",toddler bedding firetruck bundle fire truck firefighter sticker deals sign wall,0
5396,fire%20truck,,when a monster truck racer catches on fire at the fair,1
5397,fire%20truck,"Laguna Beach, Calif. ",truck fire clogs canyon road,1
5400,fire%20truck," Nevada Carson City,Freeman St",raj truck trailer catches fire in reno,1
5403,fire%20truck,,philippines former township fire truck being used in philippines a of emergency equipment in cebu philippi,1
5404,fire%20truck,LA ??,theres a fire truck in this parking lot,0
5406,fire%20truck,,evening sun article on no,0
5407,fire%20truck,,choose to be happy fire truck the rest review of kick push by,0
5408,fire%20truck,,former township fire truck being used in philippines langley times filipino,0
5409,fire%20truck,,jacksonville fire amp rescue engine awesome truck official jade fl via,1
5410,fire%20truck,Aracaju - Sergipe,turnpike a turnpike reopens hours after truck fire in,1
5411,first%20responders,,jukebox something about first responders military they are our true heros besides your music,0
5412,first%20responders,"Nashville, Tennessee",im grateful for our first responders and others who acted so swiftly to save countless lives today,1
5413,first%20responders,Texas,praying for gods healing and safety of first responders,0
5416,first%20responders,Long Eaton Ã¥Ã¡ Derbyshire Ã¥Ã¡ UK,join charity run event start sun sept castle donington community first responders,0
5417,first%20responders,WorldWide,loved the way this book was written to include so many vantage points of first responders kindle,0
5418,first%20responders,,first responders would never be sent to the wrong address again w smarties gpsbased panic button myers safety,0
5420,first%20responders,"Portage, IN / Worldwide",we can help says denver firefighter working to curb first responder suicide,1
5423,first%20responders,"Victoria, BC  Canada",whats cool is that teens are becoming what i like to call digital first responders for their friends who need a little help or support,0
5425,first%20responders,,carmine cinemas on antioch shooting we are grateful for staff and first responders safety is highest priority,1
5426,first%20responders,Roads/Trails Everywhere,rt roadie thanks to alex for his story amp to all first responders for being there when we need you a,0
5428,first%20responders,New York City,i just added sandy first responders lost their homes to vip home page group on,1
5430,first%20responders,"Nashville, TN",thankful for our first responders especially for life saving response today in antioch,1
5432,first%20responders,,juneau empire first responders turn out for national night out,0
5437,first%20responders,"Liberty Township, Ohio",i dont throw the word hero around lightly usually reserved for first responders and military but hes a hero,0
5439,first%20responders,Aberdeenshire,us wants future first responders to be more high-tech,0
5442,first%20responders,"Los Angeles, CA",theres still room for you at our party for first responders from around the country annual best ever,0
5443,first%20responders,A Hoop Somewhere,in case of accident the first responders would know that there is a baby present,0
5444,first%20responders,Michigan,kirsten gilliland extend health care to first responders,1
5445,first%20responders,"Bloomington, Indiana",we can help says denver firefighter working to curb first responder suicide,1
5446,first%20responders,USA,first responders convene for national summit and awards on gis technology gisuserpr gentech,0
5448,first%20responders,,york co first responders compete to save lives in badges for blood paramedic ems,0
5449,first%20responders,"Washington, DC",some good info to help first responders cope individual resilience factsheet for responders,0
5450,first%20responders,,no lives lost except those of first responders or the public there charged with protecting,1
5452,first%20responders,"Basking Ridge, NJ",first responders get int free on saturday details,0
5454,first%20responders,"Stalybridge, Tameside",at the emergency services display meeting the brave police firefighters and first responders that help keep us safe,1
5455,first%20responders,,this week first responders and dart members are participating in a four day intensive technical large animal,1
5458,first%20responders,"Sacramento, CA",as firefighters make gains on rockyfire jerry brown is heading to the area to meet with first responders tomorrow morning,1
5459,first%20responders,"Franklin, TN near Nashville",after shooting event at the theater is giving free coffee to all first responders police amp firefighters antiochhickoryhollowtn,1
5460,first%20responders,"St. Louis, Missouri",no lender fees for veterans or first responders past and present on,0
5461,flames,Bandung,new giant flames giant full black pantofel in order sms pin pictwittercompnpizody,1
5462,flames,New York,new snap on tools black baseball hatch silver-grey embroidered s logo flames full red,0
5465,flames,New York,new snap on tools black baseball hatch silver-grey embroidered s logo flames full red,0
5466,flames,"Louisville, KY ",vampire going through the table of flames ultimalucha luchaunderground,0
5467,flames,,cabin fever flames,0
5468,flames,"Manhattan, NY",if you cant summon the flames directly from hell store bought is fine bodies,0
5469,flames,Freeport Ny,just added some more fire to the flames for saturday rick wonder will be spinning a guest set along with coach,0
5471,flames,650/559,yoga flames,0
5473,flames,,station flames what makes a good penalty killer,0
5475,flames,dreamy lake,i guess you can say igs hopes went up in flames,0
5476,flames,,ill cry until my pity party in flames,0
5477,flames,houstn,that new lil b x chance is nothing but flames,0
5479,flames,hell,i wish i was good enough to add flames to my nails im on fire,1
5480,flames,"Asheville, NC",my gang walking round with them brown flames amp thats,0
5481,flames,New York,new snap on tools black baseball hatch silver-grey embroidered s logo flames full red,0
5482,flames,St. Patrick's Purgatory,dude was just smoking and the fucking thing went up in flames i though a bomb went off omg scared,1
5484,flames,,maryland mansion fire that killed caused by damaged plug under christmas tree report says into the flames,1
5485,flames,@cockerelshoes,new giant flames giant manly brown in order sms pin,0
5486,flames,United States,you see the devastation amp its shocking firefighters continue to battle flames in california benstracy reports a,1
5487,flames,manaus,watching it go up in flames,1
5488,flames,"Sioux Falls, S.D. ",rp said they can see smoke coming from the silo on street in hartford but no flames,1
5489,flames,,i chose you so if we can search for the joy of just the two of us well be near smiles no matter what cold flames burn our bod portgassdk,0
5491,flames,Republica Dominicana,maryland mansion fire that killed caused by damaged plug under christmas tree report says into the flames firefighters bravery,1
5492,flames,"Eastlake, OH",everyone is setting flames upon me,0
5493,flames,"Hillsville/Lynchburg, VA",thats the optimistic side of me no doubt its tough but it can be done i feel like the games will pivot on defense,0
5494,flames,U.S.A,maryland mansion fire that killed caused by damaged plug under christmas tree report says into the flames,1
5495,flames,Some where,so pardon me while i burst into flames ive had enough of the world and its peoples mindless games,0
5496,flames,Travelling around the world ,want to burst into flames anna hugged him tightly,0
5497,flames," 616 ÂÃÂ¢ Kentwood , MI ",selma u not catching flames from me im just gonna be witnessing the slaughter,1
5498,flames,,bloody ell let it burn rubybot,0
5499,flames,,if you have an opinion and you dont put it on the internet you will first into flames,0
5501,flames,? Jet Life ?,i have a rising follower graph more followers in the past week get your stats right here,0
5502,flames,Fairy Tail! ,just between gray and ophelia red flames blazing around her person setting nearly everything in the area,1
5503,flames,Santo Domingo Alma Rosa ,soloquiero maryland mansion fire that killed caused by damaged plug under christmas tree report says into the flames firefighter,1
5505,flames,Somewhere Around You,maryland mansion fire that killed caused by damaged plug under christmas tree report says into the flames,1
5506,flames,Houston |??| Corsicana,you better make all your shots tomorrow cause im recording and flames will be thrown tomorrow,0
5507,flames,"Cincinnati, OH",i added a video to a playlist nicki mina up in flames official video,0
5509,flames,Bacon,he better than sean bro i can admit that sean is flames now but he better than sean,0
5510,flames,,the advantages apropos of in flames favorable regard mississauga ontario pwhvgwax,0
5514,flattened,Some other mansion,flattened all cartoonylike whoa there papa,0
5515,flattened,Chicago,the road to success is paved with pennies that i flattened on the train tracks your welcome,0
5517,flattened,"Astley, Manchester",feel like ive been flattened by a sumo wrestler no pain no gain matai wantmyabsback strong,0
5518,flattened,"Bow, NH",ideas in food flattened,0
5519,flattened,Leicester,zoom has just flattened him there cfc,0
5520,flattened,"Frome, Somerset, England",zoom has just absolutely flattened that guy,0
5521,flattened,Mars,flattened,0
5522,flattened,"Melbourne, Victoria",years ago the first atomic attack flattened hiroshima days later it was nagasaki both war crimes to put moscow in its place,1
5524,flattened,UK,today august is the anniversary of bomb little boy been dropped on hiroshima killed outright as the city was flattened,1
5525,flattened,"Essex, England",would have just flattened the little midget,0
5526,flattened,"new york, ny",who said this yosemite sam or drum nobody will vote for a flattened out rabbit skin huh huh a i always say,0
5528,flattened,somewhere too cold for me,when he flattened machidadid he lose that tightrope he lost fights to guys he should of lost to also,1
5529,flattened,Barbados,flattened early birds does get de cups so lag bout pun de dock and watch ppl drink,0
5531,flattened,,conklin being flattened shuffled feet instead of kick slide dint get hands up into chest,0
5532,flattened,Leeds,flattened thee striker,1
5534,flattened,"Wahpeton, ND",picking up flattened hay men maronite in wahpeton nd,0
5535,flattened,,zoom just flattened that guy,0
5538,flattened,"Chorley, Lancashire, UK",fylde building set to be flattened one of preston city centre iconic buildings is disappearing from the skyline,0
5539,flattened,,hide your kids hide your wife hes on the loose i thought i flattened you with a ball,0
5540,flattened,,would been great if moira just flattened that little rat,0
5541,flattened,"Northampton, MA",puckflattened ball lol,0
5544,flattened,Ventura,i dont doubt it but it was his implicit statement in doing it that makes me want him flattened by a bus,0
5545,flattened,Le Memenet,and flattened raynor raynor was a balding imperfect biker marine not a emo generic western hero,0
5547,flattened,"Lubbock, Texas",i think the risk of losing and getting her nose flattened has a lot to do with it,0
5548,flattened,Derby,mums literally just picked up her new car today and flattened the battery already trying to sort out the bluetooth muppet,0
5552,flattened,"Mississauga, Ontario",notley flattened harper in his heartland harper imported tens of thousands of tow slaves cost alberta jobs,0
5553,flattened,Delhi ,flattened frog,0
5554,flattened,"Keighley, England",imagine getting flattened by kurt zoom,0
5555,flattened,Pomfret/Providence,the fallacy is it is up to the steam roller its up to the object whether it will be flattened or not robertcalifornia thereisonlysex,0
5556,flattened,"Baltimore, MD",photo beach earrings beach jewelry vacation earrings keep calm and beach on earrings made with flattened,0
5557,flattened,,mix new flat double sided lifeless bottle caps you choose mix flattened full red,0
5558,flattened,"East Lansing, MI",flat footballs more like he flattened the spartans from crushing them back in the day hail,0
5559,flattened,Rocketing through the galaxy,ever seen by far a dreamy look came over his face and his ears flattened as he started to walk slowly toward her you,1
5560,flattened,New York,mix new flat double sided lifeless bottle caps you choose mix flattened full red,0
5561,flood,boston,when fizzy is sitting in the regular flood seats and no one knows who she is,0
5563,flood,United States,jul cancels flash flood warning for bell harland knox ky we,1
5564,flood,New York,spot flood combo curved cree led work light bar off-road fog lamp full red,1
5565,flood,New York,spot flood combo curved cree led work light bar off-road fog lamp full red,0
5567,flood,"Warrandyte, Australia",a small flood with bigñconsequences,1
5569,flood,"British Columbia, Canada",homecoming queen killed on way home from the prom by flood waters socialnews,1
5570,flood,,cree led work light off-road lamp car truck boat mining flood beam full real,0
5573,flood,,its been raining since you left me now im drowning in the flood you see ive always been a fighter but without you i give up,0
5575,flood,Aix-en-Provence/Utrecht,yet still why did so many fish die in the worldwide flood i wonder,0
5576,flood,Philadelphia,and please dont flood poor mentions hes put in his work,1
5577,flood,New York,spot flood combo curved cree led work light bar off-road fog lamp full red,0
5578,flood,"Van Buren, MO",but he dint,0
5579,flood,New York,cree led work light bar alloy spot flood combo diving off-road boat full read,0
5580,flood,New York,cree led work light off-road lamp car truck boat mining flood beam full real,1
5581,flood,"Niagara Falls, Ontario",cue the flood of people ironically calling you that,0
5582,flood,USA,motors hot deals ggt led work light flood lamp tractor truck sun utv a,0
5584,flood,,led warm white light motion sensor outdoor flood light pir lamp anc,0
5586,flood,Hawaii USA,iembothfo at am now hana maui co hi county official reports coastal flood a,1
5587,flood,New York,pair new round led work driving flood light off-road atv utv full read by bay,0
5588,flood,New York,cree led work light off-road lamp car truck boat mining flood beam full real,0
5589,flood,,internet basics the flood defective intertissue is soul mate the milk trench host guabxfv,1
5590,flood,,bmx issues areal flood advisory for shelby al till aug pm cdt,1
5592,flood,New York,cree led work light off-road lamp car truck boat mining flood beam full real,0
5593,flood,USA,flood advisory in effect for shelby county in al until pm alex,1
5594,flood,United States,rt grantfactory grants funds weymouth meeting on seagulls and flood grants set for thursday night a,1
5595,flood,New York,spot flood combo curved cree led work light bar off-road fog lamp full red,0
5598,flood,New York,spot flood combo curved cree led work light bar off-road fog lamp full red,0
5599,flood,New York,spot flood combo curved cree led work light bar off-road fog lamp full red,0
5600,flood,United States,flood advisory issued august at edt by news way,1
5602,flood,,survived the plague floated the flood just peeked our heads above the mud no ones immune deafening bells my god will we survive ourselves,0
5603,flood,New York,spot flood combo curved cree led work light bar off-road fog lamp full red,0
5604,flood,USA,flood prone waterways in westchester county now eligible for millions in state aid new-york,1
5605,flood,Waddesdon,chinese rescue team arrives in myanmar to help flood victims sittway,1
5608,flood,"Knoxville, TN",flood advisory issued august at cdt until august at cdt by news the urban and weather,1
5609,flood,New York,cree led work light bar alloy spot flood combo diving off-road boat full read,0
5611,flooding,"Rock Springs, WY",rock springs a residents living off elk street continue to battle flooding issues after mondays rain storm while,1
5612,flooding,Vietnam,cuban leader extends sympathy to vietnam over flooding at,1
5613,flooding,"Tampa-St. Petersburg, FL",business at the sponge docks washed out by rain flooding,1
5614,flooding,,he thrusts a little more before he jams his cock deep inside her flooding her womb and pussy with his hot thick cum,0
5617,flooding,USA,severe thunderstorms and flash flooding possible in the sidmouth and midwest weather environment climate nature,1
5618,flooding,"Huntsville, Alabama",radar update widespread showersstorms but moving over the same areasminor flooding possible unix,1
5619,flooding,"Nova Scotia, Canada",tips to prevent basement leaks create control joints to eliminate random cracking homeimprovement flooding,0
5620,flooding,,flooding,1
5621,flooding,Metro Manila,no reported flooding po in the area ten nmda,0
5622,flooding,,flooding kills displace over one million in pakistan daily news amp analysis yugvani,1
5624,flooding,Breaking News,flooding kills displace over one million in pakistan daily news amp analysis,1
5625,flooding,Jakarta/Kuala Lumpur/S'pore,laos flooding villages underwater world vision responding,1
5626,flooding,UK,floods floods british trekkers rescued amid flash floods in himalayas a group of british tr flooding,1
5627,flooding,,maybe the plan is to dilute until they can safely say we have to start charging or its over longs would come flooding in,0
5628,flooding,Vietnam,cuban leader extends sympathy to vietnam over flooding at,1
5629,flooding,,ill only dm hotel info because people are flooding my notifications asking me for info,0
5631,flooding,I ACCEPT SONG REQUESTS,when the waves are flooding the shore and i cant find my way home anymore thats when i look at you,1
